<?xml version="1.0" encoding="UTF-8"?>
<vehicles xmlns:xsi="http://www.w3.org/2001/XMLSchema-instance"
          xsi:noNamespaceSchemaLocation="test.xsd">
  <car>
    <brand>Audi</brand>
    <model>A6</model>
    <year>2022</year>
    <serialNumber>12345</serialNumber>
    <numberOfTires>4</numberOfTires>
    <inside>
      <numberOfSeats>5</numberOfSeats>
    </inside>
    <performances>
      <maxSpeed>250</maxSpeed>
      <maxPower>250</maxPower>
      <maxTorque>350</maxTorque>
    </performances>
    <characteristics>
      <weightEmpty>1500</weightEmpty>
      <maxWeight>2000</maxWeight>
      <usableWeight>500</usableWeight>
    </characteristics>
    <shape>Sedan</shape>
    <price>50000</price>
  </car>
  <car>
    <brand>BMW</brand>
    <model>X5</model>
    <year>2021</year>
    <serialNumber>67890</serialNumber>
    <numberOfTires>4</numberOfTires>
    <inside>
      <numberOfSeats>5</numberOfSeats>
    </inside>
    <performances>
      <maxSpeed>240</maxSpeed>
      <maxPower>300</maxPower>
      <maxTorque>400</maxTorque>
    </performances>
    <characteristics>
      <weightEmpty>1800</weightEmpty>
      <maxWeight>2200</maxWeight>
      <usableWeight>400</usableWeight>
    </characteristics>
    <shape>SUV</shape>
    <price>60000</price>
  </car>
  <motorcycle>
    <brand>Yamaha</brand>
    <model>YZF-R6</model>
    <year>2020</year>
    <serialNumber>54321</serialNumber>
    <numberOfTires>2</numberOfTires>
    <performances>
      <maxSpeed>280</maxSpeed>
      <maxPower>120</maxPower>
      <maxTorque>65</maxTorque>
    </performances>
    <characteristics>
      <weightEmpty>200</weightEmpty>
      <maxWeight>300</maxWeight>
      <usableWeight>100</usableWeight>
    </characteristics>
    <shape>Sport</shape>
    <price>10000</price>
  </motorcycle>
  <truck>
    <type>Truck</type>
    <brand>Volvo</brand>
    <model>FH16</model>
    <year>2019</year>
    <serialNumber>98765</serialNumber>
    <numberOfTires>12</numberOfTires>
    <inside>
      <numberOfSeats>2</numberOfSeats>
    </inside>
    <performances>
      <maxSpeed>120</maxSpeed>
      <maxPower>500</maxPower>
      <maxTorque>2500</maxTorque>
    </performances>
    <characteristics>
      <weightEmpty>8000</weightEmpty>
      <maxWeight>40000</maxWeight>
      <usableWeight>32000</usableWeight>
    </characteristics>
    <shape>Box</shape>
    <price>80000</price>
  </truck>
  <tricycle>
    <brand>Piaggio</brand>
    <model>MP3</model>
    <year>2021</year>
    <serialNumber>13579</serialNumber>
    <numberOfTires>3</numberOfTires>
    <inside>
      <numberOfSeats>2</numberOfSeats>
    </inside>
    <performances>
      <maxSpeed>140</maxSpeed>
      <maxPower>30</maxPower>
      <maxTorque>45</maxTorque>
    </performances>
    <characteristics>
      <weightEmpty>250</weightEmpty>
      <maxWeight>400</maxWeight>
      <usableWeight>150</usableWeight>
    </characteristics>
    <shape>Scooter</shape>
    <price>5000</price>
  </tricycle>
</vehicles>
